<?xml version = "1.0" encoding = "UTF-8" standalone = "yes" ?>
<template xmlns:xsi="http://www.w3.org/2001/XMLSchema-instance" xsi:noNamespaceSchemaLocation="settlement.xsd"
    name="Phase 1-SA" default-population="4" description="Phase 1 base for Saudi Arabia"
	sponsor="SSA">

    <building id="0" type="Lander Hab" xloc="0.0" yloc="0.0"
        facing="0.0">
        <connection-list>
            <connection id="1" xloc="4.5" yloc="0.0" />
            <connection id="2" xloc="-4.5" yloc="0.0" />
        </connection-list>
    </building>

    <!-- EVA Airlock is attached to the lander hab -->
    <building id="1" type="EVA Airlock" xloc="7.5" yloc="0.0"
        facing="0.0">
        <connection-list>
            <connection id="0" xloc="-3.0" yloc="0.0" />
        </connection-list>
    </building>

    <building id="2" type="Hallway" length="3.0" xloc="-6.0"
        yloc="0.0" facing="270.0">
        <connection-list>
            <connection id="0" xloc="0.0" yloc="1.5" />
            <connection id="3" xloc="0.0" yloc="-1.5" />
        </connection-list>
    </building>

    <building id="3" type="Lounge" xloc="-12.0" yloc="0.0"
        facing="270.0">
        <connection-list>
            <connection id="2" xloc="0.0" yloc="4.5" />
            <connection id="4" xloc="0.0" yloc="-4.5" />
        </connection-list>
    </building>

    <building id="4" type="Hallway" length="3.0" xloc="-18.0"
        yloc="0.0" facing="270.0">
        <connection-list>
            <connection id="3" xloc="0.0" yloc="1.5" />
            <connection id="5" xloc="0.0" yloc="-1.5" />
        </connection-list>
    </building>

    <building id="5" type="Inflatable Greenhouse" xloc="-24.0"
        yloc="0.0" facing="270.0">
        <connection-list>
            <connection id="4" xloc="0.0" yloc="4.5" />
        </connection-list>
    </building>


    <!-- Building Packages -->
    <building-package name="Storage Set 1"/>
   	<building-package name="ERV Set 1"/>
   	<building-package name="Air Set 1 - 1x1"/>
   	<building-package name="Solar Set 1 - 1x9"/>
	<building-package name="Kilo Set 1 - 1x2"/>
 	<building-package name="Brine Water Well Set 1 - 1x1"/>
 	 		   		
    <initial-supplies>
 	 		   		
	    <vehicle type="Explorer Rover" number="2" />
	    <vehicle type="Light Utility Vehicle" number="1" />
	    <vehicle type="Delivery Drone" number="1" />
	
	    <!-- Standard Phase 1 allocation-->
	    <robot type="GardenBot-Advanced" number="1"/>
	    <robot type="MakerBot-Standard" number="1"/>
	    <robot type="MedicBot-Advanced" number="1"/>
	    <robot type="RepairBot-Standard" number="1"/>
	
	    <equipment type="EVA Suit" number="8" />
   	    <equipment type="Data Recorder" number="4" />
   	    
	    <!-- Containers-->
		<equipment type="barrel" number="40" />
		<equipment type="bag" number="40" />
		<equipment type="gas canister" number="40" />		
		<equipment type="large bag" number="40" />
		<equipment type="specimen box" number="40" />
	    <equipment type="thermal bottle" number="8" />	
	 	<equipment type="wheelbarrow" number="12" />
	
	    <!-- Life Support Resources -->
		<resource type="food" amount="720" />
		<resource type="water" amount="3600" />
		<resource type="oxygen" amount="1440" />
		
  		<part-package name="Instrument Package 1" number="1" />	
	    <part-package name="Standard Part Package 1" number="1" />
	 	 		   		
    </initial-supplies>


    <resupply>
        <resupply-mission name="Food Delivery" manifest-name="Food Resupply 1">
            <schedule firstSol="1" frequency="80" />
        </resupply-mission>
        <resupply-mission name="Phase 1 Delivery" manifest-name="Resupply for Phase 1">
                <schedule frequency="120" />
        </resupply-mission>
    </resupply>
</template>