<?xml version = "1.0" encoding = "UTF-8" standalone = "yes" ?>
<template xmlns:xsi="http://www.w3.org/2001/XMLSchema-instance" xsi:noNamespaceSchemaLocation="settlement.xsd"
    name="Phase 3-SX" default-population="12" description="Phase 3 for SpaceX"
    sponsor="SPACEX">
    
    <building id="0" type="Lander Hab" xloc="0.0" yloc="0.0"
        facing="0.0">
        <connection-list>
            <connection id="1" xloc="0.0" yloc="4.5" />
            <connection id="5" xloc="-4.5" yloc="0.0" />
            <connection id="21" xloc="4.5" yloc="0.0" />
        </connection-list>
    </building>
    <building id="1" type="Hallway" length="4.0" xloc="0.0"
        yloc="6.5" facing="0.0">
        <connection-list>
            <connection id="0" xloc="0.0" yloc="-2.0" />
            <connection id="2" xloc="0.0" yloc="2.0" />
        </connection-list>
    </building>
    <building id="2" type="Research Hab" xloc="0.0" yloc="13.0"
        facing="0.0">
        <connection-list>
            <connection id="1" xloc="0.0" yloc="-4.5" />
            <connection id="3" xloc="0.0" yloc="4.5" />
            <connection id="9" xloc="-4.5" yloc="0.0" />
        </connection-list>
    </building>
    <building id="3" type="Hallway" length="4.0" xloc="0.0"
        yloc="19.5" facing="0.0">
        <connection-list>
            <connection id="2" xloc="0.0" yloc="-2.0" />
            <connection id="4" xloc="0.0" yloc="2.0" />
        </connection-list>
    </building>
    <building id="4" type="Storage Hab" xloc="0.0" yloc="26.0"
        facing="0.0">
        <connection-list>
            <connection id="3" xloc="0.0" yloc="-4.5" />
            <connection id="13" xloc="-4.5" yloc="0.0" />
        </connection-list>
    </building>

    <!-- The first row -->
    <building id="5" type="Hallway" length="3.0" xloc="-6.0"
        yloc="0.0" facing="270.0">
        <connection-list>
            <connection id="0" xloc="0.0" yloc="1.5" />
            <connection id="6" xloc="0.0" yloc="-1.5" />
        </connection-list>
    </building>
    <building id="6" type="Lounge" xloc="-12.0" yloc="0.0"
        facing="270.0">
        <connection-list>
            <connection id="5" xloc="0.0" yloc="4.5" />
            <connection id="7" xloc="0.0" yloc="-4.5" />
        </connection-list>
    </building>

    <building id="7" type="Hallway" length="3.0" xloc="-18.0"
        yloc="0.0" facing="270.0">
        <connection-list>
            <connection id="6" xloc="0.0" yloc="1.5" />
            <connection id="8" xloc="0.0" yloc="-1.5" />
        </connection-list>
    </building>
    <building id="8" type="Residential Quarters" xloc="-24.0"
        yloc="0.0" facing="270.0">
        <connection-list>
            <connection id="7" hatch-facing="west" />
            <connection id="17" hatch-facing="north" />
            <connection id="19" hatch-facing="south" />
        </connection-list>
    </building>

    <!-- The second row -->
    <building id="9" type="Hallway" length="3.0" xloc="-6.0"
        yloc="13.0" facing="270.0">
        <connection-list>
            <connection id="2" xloc="0.0" yloc="1.5" />
            <connection id="10" xloc="0.0" yloc="-1.5" />
        </connection-list>
    </building>
    <building id="10" type="Inflatable Greenhouse" xloc="-12.0"
        yloc="13.0" facing="270.0">
        <connection-list>
            <connection id="9" xloc="0.0" yloc="4.5" />
            <connection id="11" xloc="0.0" yloc="-4.5" />
        </connection-list>
    </building>

    <building id="11" type="Hallway" length="3.0" xloc="-18.0"
        yloc="13.0" facing="270.0">
        <connection-list>
            <connection id="10" xloc="0.0" yloc="1.5" />
            <connection id="12" xloc="0.0" yloc="-1.5" />
        </connection-list>
    </building>
    <building id="12" type="Fish Farm" xloc="-24.0"
        yloc="13.0" facing="270.0">
        <connection-list>
            <connection id="11" hatch-facing="west" />
            <connection id="17" hatch-facing="south" />
            <connection id="18" hatch-facing="north" />
        </connection-list>
    </building>

    <!-- The third row -->
    <building id="13" type="Hallway" length="3.0" xloc="-6.0"
        yloc="26.0" facing="270.0">
        <connection-list>
            <connection id="4" xloc="0.0" yloc="1.5" />
            <connection id="14" xloc="0.0" yloc="-1.5" />
        </connection-list>
    </building>
    <building id="14" type="Laboratory" xloc="-12.0" yloc="26.0"
        facing="270.0">
        <connection-list>
            <connection id="13" xloc="0.0" yloc="4.5" />
            <connection id="15" xloc="0.0" yloc="-4.5" />
        </connection-list>
    </building>

    <building id="15" type="Hallway" length="3.0" xloc="-18.0"
        yloc="26.0" facing="270.0">
        <connection-list>
            <connection id="14" xloc="0.0" yloc="1.5" />
            <connection id="16" xloc="0.0" yloc="-1.5" />
        </connection-list>
    </building>
    <building id="16" type="Workshop" xloc="-24.0"
        yloc="26.0" facing="270.0">
        <connection-list>
            <connection id="15" hatch-facing="west" />
            <connection id="18" hatch-facing="south" />
        </connection-list>
    </building>

    <!-- This hallway connects the residential quarters on the first row
        to the fish farm of second row -->
    <building id="17" type="Hallway" length="6.5" xloc="-24.0"
        yloc="6.75" facing="0.0">
        <connection-list>
            <connection id="8"  hatch-facing="south" />
            <connection id="12" hatch-facing="north" />
        </connection-list>
    </building>

    <!-- This hallway connects the fish farm on the second row
        to the workshop of the third row -->
    <building id="18" type="Hallway" length="6.5" xloc="-24.0"
        yloc="19.25" facing="0.0">
        <connection-list>
            <connection id="12" hatch-facing="south" />
            <connection id="16" hatch-facing="north" />
        </connection-list>
    </building>

    <!-- This hallway connects the residential quarters in the first row
        to the garage -->
    <building id="19" type="Hallway" length="3.5" xloc="-24.0"
        yloc="-5.25" facing="0.0">
        <connection-list>
            <connection id="8" hatch-facing="north" />
            <connection id="20" hatch-facing="south" />
        </connection-list>
    </building>

    <building id="20" type="Garage" xloc="-24.0" yloc="-15"
        facing="180.0">
        <connection-list>
            <connection id="19" xloc="0.0" yloc="-8.0" />
        </connection-list>
    </building>

    <!-- EVA Airlock is attached to the lander hab -->
    <building id="21" type="EVA Airlock" xloc="7.5" yloc="0.0"
        facing="0.0">
        <connection-list>
            <connection id="0" xloc="-3.0" yloc="0.0" />
        </connection-list>
    </building>


    <!-- Building Packages -->
    <building-package name="Storage Set 1"/>   
   	<building-package name="ERV Set 1"/>
   	<building-package name="ERV Set 2"/>
   	<building-package name="Air Set 1 - 1x3"/>
    <building-package name="Sabatier Set 1 - 1x4"/> 
	<building-package name="Solar Set 1 - 1x9"/>
	<building-package name="Solar Thermal Set 1 - 1x9"/>
	<building-package name="Kilo Set 1 - 1x4"/>
	<building-package name="MD1 Set 1 - 1x3"/>
	<building-package name="Small Areothermal Well Set 1 - 1x1"/> 	
 	<building-package name="Brine Water Well Set 1 - 1x2"/>	 	
	
    <initial-supplies>
	
	    <vehicle type="Explorer Rover" number="3" />
	    <vehicle type="Transport Rover" number="2" />
	    <vehicle type="Cargo Rover" number="2" />
	    <vehicle type="Light Utility Vehicle" number="3" />
	    <vehicle type="Delivery Drone" number="3" />
	
	    <!-- Standard Phase 3 allocation-->
	    <robot type="GardenBot-Advanced" number="2"/>
	    <robot type="MakerBot-Standard" number="2"/>
	    <robot type="MedicBot-Advanced" number="1"/>
	    <robot type="RepairBot-Standard" number="2"/>
	    <robot type="DeliveryBot-Advanced" number="1"/>
	    <robot type="ChefBot-Standard" number="1"/>
	    
	    <equipment type="EVA Suit" number="24" />
   	    <equipment type="Data Recorder" number="12" />
   	    
	    <!-- Containers-->
		<equipment type="barrel" number="80" />
		<equipment type="bag" number="80" />
		<equipment type="gas canister" number="80" />		
		<equipment type="large bag" number="80" />
		<equipment type="specimen box" number="80" />
	    <equipment type="thermal bottle" number="18" />	
	 	<equipment type="wheelbarrow" number="18" />
	 	
		<!-- Life Support Resources -->
		<resource type="food" amount="2160" />
		<resource type="water" amount="6000" />
		<resource type="oxygen" amount="4320" />
		
  		<part-package name="Instrument Package 1" number="3" />	
	    <part-package name="Standard Part Package 1" number="3" />
		
    </initial-supplies>

 
    <resupply>
       	<resupply-mission name="BiMonthly Delivery" manifest-name="Standard Resupply 1">
            <schedule firstSol="30" frequency="60" />
        </resupply-mission>
        <resupply-mission name="Phase 3 Delivery" manifest-name="Resupply for Phase 3">
            <schedule firstSol="668" />
        </resupply-mission> 
    </resupply>
</template>