<?xml version = "1.0" encoding = "UTF-8" standalone = "yes" ?>
<template xmlns:xsi="http://www.w3.org/2001/XMLSchema-instance" xsi:noNamespaceSchemaLocation="settlement.xsd"
    name="Phase 2-HU" default-population="8" description="Phase 2 base for HSO/Hungary"
	sponsor="HSO">
    
    <building id="0" type="Lander Hab" xloc="0.0" yloc="0.0"
        facing="0.0">
        <connection-list>
            <connection id="2" xloc="-4.5" yloc="0.0" />
            <connection id="1" xloc="0.0" yloc="4.5" />
            <connection id="12" xloc="4.5" yloc="0.0" />
        </connection-list>
    </building>

    <!-- This hallway connects the lander hab on the first row and the research
        hab on the second row -->
    <building id="1" type="Hallway" length="4.0" xloc="0.0"
        yloc="6.5" facing="0.0">
        <connection-list>
            <connection id="0" xloc="0.0" yloc="-2.0" />
            <connection id="6" xloc="0.0" yloc="2.0" />
        </connection-list>
    </building>

    <building id="2" type="Hallway" length="3.0" xloc="-6.0"
        yloc="0.0" facing="270.0">
        <connection-list>
            <connection id="0" xloc="0.0" yloc="1.5" />
            <connection id="3" xloc="0.0" yloc="-1.5" />
        </connection-list>
    </building>

    <building id="3" type="Workshop" xloc="-12.0" yloc="0.0"
        facing="270.0">
        <connection-list>
            <connection id="2" xloc="0.0" yloc="4.5" />
            <connection id="4" xloc="0.0" yloc="-4.5" />
        </connection-list>
    </building>

    <building id="4" type="Hallway" length="3.0" xloc="-18.0"
        yloc="0.0" facing="270.0">
        <connection-list>
            <connection id="3" xloc="0.0" yloc="1.5" />
            <connection id="5" xloc="0.0" yloc="-1.5" />
        </connection-list>
    </building>

    <building id="5" type="Algae Pond" xloc="-24.0"
        yloc="0.0" facing="270.0">
        <connection-list>
            <connection id="4" xloc="0.0" yloc="4.5" />
            <connection id="11" xloc="-3.0" yloc="0.0" />
        </connection-list>
    </building>

    <building id="6" type="Lander Hab" xloc="0.0" yloc="13.0"
        facing="0.0">
        <connection-list>
            <connection id="1" xloc="0.0" yloc="-4.5" />
            <connection id="7" xloc="-4.5" yloc="0.0" />
        </connection-list>
    </building>

    <building id="7" type="Hallway" length="3.0" xloc="-6.0"
        yloc="13.0" facing="270.0">
        <connection-list>
            <connection id="6" xloc="0.0" yloc="1.5" />
            <connection id="8" xloc="0.0" yloc="-1.5" />
        </connection-list>
    </building>

    <building id="8" type="Laboratory" xloc="-12.0" yloc="13.0"
        facing="270.0">
        <connection-list>
            <connection id="7" xloc="0.0" yloc="4.5" />
            <connection id="9" xloc="0.0" yloc="-4.5" />
        </connection-list>
    </building>

    <building id="9" type="Hallway" length="3.0" xloc="-18.0"
        yloc="13.0" facing="270.0">
        <connection-list>
            <connection id="8" xloc="0.0" yloc="1.5" />
            <connection id="10" xloc="0.0" yloc="-1.5" />
        </connection-list>
    </building>

    <building id="10" type="Inflatable Greenhouse" xloc="-24.0"
        yloc="13.0" facing="270.0">
        <connection-list>
            <connection id="9" xloc="0.0" yloc="4.5" />
            <connection id="11" xloc="3.0" yloc="0.0" />
        </connection-list>
    </building>

    <!-- This hallway connects the inflatable greenhouse on the first row
        and the inflatable greenhouse on the second row -->
    <building id="11" type="Hallway" length="7.0" xloc="-24.0"
        yloc="6.5" facing="0.0">
        <connection-list>
            <connection id="5" xloc="0.0" yloc="-3.5" />
            <connection id="10" xloc="0.0" yloc="3.5" />
        </connection-list>
    </building>

    <!-- EVA Airlock is attached to the lander hab -->
    <building id="12" type="EVA Airlock" xloc="7.5" yloc="0.0"
        facing="0.0">
        <connection-list>
            <connection id="0" xloc="-3.0" yloc="0.0" />
        </connection-list>
    </building>

    <!-- Building Packages -->
    <building-package name="Storage Set 1"/>
   	<building-package name="ERV Set 1"/>
   	<building-package name="Air Set 1 - 1x2"/>
    <building-package name="Sabatier Set 1 - 1x2"/>
	<building-package name="Syngas Set 1 - 1x1"/>
	<building-package name="Solar Set 1 - 1x9"/>
   	<building-package name="Wind Set 1 - 1x6"/>	
   	<building-package name="TOPAZ-2A Set 1 - 1x3"/>
	<building-package name="TOPAZ-3 Set 1 - 1x2"/>
	<building-package name="Methane Set 1 - 1x1" />	
 	<building-package name="Brine Water Well Set 1 - 1x1"/>
 	 
    <initial-supplies>
 	 
	    <vehicle type="Explorer Rover" number="2" />
	    <vehicle type="Light Utility Vehicle" number="1" />
	    <vehicle type="Delivery Drone" number="1" />
	
	
	    <!-- Standard Phase 2 allocation-->
	    <robot type="GardenBot-Advanced" number="2"/>
	    <robot type="MakerBot-Standard" number="2"/>
	    <robot type="MedicBot-Advanced" number="1"/>
	    <robot type="RepairBot-Standard" number="2"/>
	
	    <equipment type="EVA Suit" number="16" />
   	    <equipment type="Data Recorder" number="8" />
   	    
	    <!-- Containers-->
		<equipment type="barrel" number="40" />
		<equipment type="bag" number="40" />
		<equipment type="gas canister" number="40" />		
		<equipment type="large bag" number="40" />
		<equipment type="specimen box" number="40" />
	    <equipment type="thermal bottle" number="12" />	
	 	<equipment type="wheelbarrow" number="12" />
	 	
		<!-- Life Support Resources -->
		<resource type="food" amount="1440" />
		<resource type="water" amount="4800" />
		<resource type="oxygen" amount="2880" />
	
  		<part-package name="Instrument Package 1" number="2" />	
	    <part-package name="Standard Part Package 1" number="2" />
 	 
    </initial-supplies>

   	
    <resupply>
       	<resupply-mission name="Quarterly Delivery" manifest-name="Standard Resupply 1">
            <schedule firstSol="1" frequency="150" />
        </resupply-mission>
        <resupply-mission name="Annual Delivery" manifest-name="Resupply for Phase 2">
                <schedule firstSol="668" />
        </resupply-mission>
    </resupply>
</template>