<?xml version = "1.0" encoding = "UTF-8" standalone = "yes" ?>
<template xmlns:xsi="http://www.w3.org/2001/XMLSchema-instance" xsi:noNamespaceSchemaLocation="settlement.xsd"
        name="Phase 0-MS" default-population="2" description="Phase 0 base for Mars Society"
		 sponsor="MS">

    <!-- Lander habitat building is the main habitation in the Mars Direct
        mission plan. -->
    <building id="0" type="Lander Hab" xloc="0.0" yloc="0.0"
        facing="0.0">
        <!-- List of all connections to other buildings (optional). -->
        <connection-list>
            <!-- Connection to another building. "id" is other building's ID. -->
            <!-- X & Y locations are relative to this building, not in the settlement
                locale. -->
            <connection id="1" xloc="4.5" yloc="0.0" />
            <connection id="2" xloc="-4.5" yloc="0.0" />
        </connection-list>
    </building>

    <!-- Suit Port is attached to the lander hab -->
    <building id="1" type="Suit Port" xloc="6.0" yloc="0.0" facing="-90.0">
        <connection-list>
            <connection id="0" hatch-facing="east"  />
        </connection-list>
    </building>

    <!-- Hallway connecting lander hab and inflatable greenhouse. -->
    <!-- Note: A hallway has fixed width but variable length. Therefore,
        the length argument must be provided below. -->
    <building id="2" type="Hallway" length="3.0" xloc="-6.0" yloc="0.0" facing="270.0">
        <connection-list>
            <connection id="0" xloc="0.0" yloc="1.5" />
            <connection id="3" xloc="0.0" yloc="-1.5" />
        </connection-list>
    </building>

    <!-- Inflatable greenhouse can be used to grow crops. -->
    <building id="3" type="Inflatable Greenhouse" xloc="-12.0" yloc="0.0" facing="270.0">
        <connection-list>
            <connection id="2" xloc="0.0" yloc="4.5" />
        </connection-list>
    </building>


    <!-- Building Packages -->
    <building-package name="Storage Set 1"/>
   	<building-package name="ERV Set 1"/>
   	<building-package name="Air Set 1 - 1x1"/>
    <building-package name="Sabatier Set 1 - 1x1"/>
   	<building-package name="Nuclear Set 1 - Combo 0"/>
    <building-package name="Solar Set 1 - 1x6"/>
   		
    <!-- A rover for collecting rock samples from remote sites and ice prospecting. -->
    <initial-supplies>
	    <vehicle type="Explorer Rover" number="2" />
	    <vehicle type="Light Utility Vehicle" number="1" />
	    <vehicle type="Delivery Drone" number="1" />
	
	    <!-- Standard Phase 0 allocation-->
	    <robot type="MakerBot-Standard" number="1"/>
	    <robot type="MedicBot-Standard" number="1"/>
	    <robot type="RepairBot-Standard" number="1"/>
	    <robot type="GardenBot-Standard" number="1"/>
	    
	    <!-- Equipment -->
	    <equipment type="EVA Suit" number="8" />
   	    <equipment type="Data Recorder" number="4" />
   	    
	    <!-- Containers-->
		<equipment type="barrel" number="40" />
		<equipment type="bag" number="40" />
		<equipment type="gas canister" number="40" />		
		<equipment type="large bag" number="40" />
		<equipment type="specimen box" number="40" />
	    <equipment type="thermal bottle" number="8" />	
	 	<equipment type="wheelbarrow" number="12" />
	
	    <!-- Bins -->
		<bin type="pot" number="20" />
		<bin type="crate" number="20" />
		<bin type="basket" number="20" />
	
	    <!-- Resources -->
	    <!-- type: the type of resource (see resources.txt) -->
	    <!-- amount: the amount of the resource (kg) -->
	
	    <!-- Mars Direct Mission Plan : 
	    (1). ERV - 
	    	(a). Payload imported from Earth - 
	    		 Consumables - Hydrogen : 3400 kg  
	    		 Feedstock - Hydrogen : 6300 kg 
	        (b). Produced on Mars : 
	        	 Water : 18900 kg 
	        	 Oxygen : 16080 kg 
	        	 Methane : 8400 kg 
	    (2). Hab -
	        (a). Payload imported from Earth - 
	             Consumables - Hydrogen : 7000 kg 
	    -->
	
	    <!-- Life Support Resources -->
		<resource type="food" amount="720" />
		<resource type="water" amount="3600" />
		<resource type="oxygen" amount="1440" />
		
	
	    <!-- Crop -->
	    <!-- No starting crops for this template -->
	
	    <!-- Part packages (see part_packages.xml) -->
	    <!-- name: the part package name. -->
	    <!-- number: the number of packages. -->
  		<part-package name="Instrument Package 1" number="1" />	
	    <part-package name="Standard Part Package 1" number="1" />
	
	    <!-- The resupply missions from Earth scheduled for this type of settlement. -->
    </initial-supplies>

    <resupply>
        <resupply-mission name="Food Delivery" manifest-name="Food Resupply 1">
            <schedule firstSol="30" frequency="60" /> 
        </resupply-mission>
        <resupply-mission name="Phase 0 Delivery" manifest-name="Resupply for Phase 0">
            <schedule firstSol="120"/>
        </resupply-mission>
    </resupply>
</template>