<?xml version = "1.0" encoding = "UTF-8" standalone = "yes" ?>
<template xmlns:xsi="http://www.w3.org/2001/XMLSchema-instance" xsi:noNamespaceSchemaLocation="settlement.xsd"
    name="Phase 3-IN" default-population="12" description="Phase 3 for ISRO"
    number-of-robots="7" sponsor="ISRO">
    
    <building id="0" type="Lander Hab" xloc="0.0" yloc="0.0"
        facing="0.0">
        <connection-list>
            <connection id="1" xloc="0.0" yloc="4.5" />
            <connection id="5" xloc="-4.5" yloc="0.0" />
            <connection id="21" xloc="4.5" yloc="0.0" />
        </connection-list>
    </building>
    <building id="1" type="Hallway" length="4.0" xloc="0.0"
        yloc="6.5" facing="0.0">
        <connection-list>
            <connection id="0" xloc="0.0" yloc="-2.0" />
            <connection id="2" xloc="0.0" yloc="2.0" />
        </connection-list>
    </building>
    <building id="2" type="Research Hab" xloc="0.0" yloc="13.0"
        facing="0.0">
        <connection-list>
            <connection id="1" xloc="0.0" yloc="-4.5" />
            <connection id="3" xloc="0.0" yloc="4.5" />
            <connection id="9" xloc="-4.5" yloc="0.0" />
        </connection-list>
    </building>
    <building id="3" type="Hallway" length="4.0" xloc="0.0"
        yloc="19.5" facing="0.0">
        <connection-list>
            <connection id="2" xloc="0.0" yloc="-2.0" />
            <connection id="4" xloc="0.0" yloc="2.0" />
        </connection-list>
    </building>
    <building id="4" type="Storage Hab" xloc="0.0" yloc="26.0"
        facing="0.0">
        <connection-list>
            <connection id="3" xloc="0.0" yloc="-4.5" />
            <connection id="13" xloc="-4.5" yloc="0.0" />
        </connection-list>
    </building>

    <!-- The first row -->
    <building id="5" type="Hallway" length="3.0" xloc="-6.0"
        yloc="0.0" facing="270.0">
        <connection-list>
            <connection id="0" xloc="0.0" yloc="1.5" />
            <connection id="6" xloc="0.0" yloc="-1.5" />
        </connection-list>
    </building>
    <building id="6" type="Laboratory" xloc="-12.0" yloc="0.0"
        facing="270.0">
        <connection-list>
            <connection id="5" xloc="0.0" yloc="4.5" />
            <connection id="7" xloc="0.0" yloc="-4.5" />
        </connection-list>
    </building>
    <building id="7" type="Hallway" length="3.0" xloc="-18.0"
        yloc="0.0" facing="270.0">
        <connection-list>
            <connection id="6" xloc="0.0" yloc="1.5" />
            <connection id="8" xloc="0.0" yloc="-1.5" />
        </connection-list>
    </building>
    <building id="8" type="Inflatable Greenhouse" xloc="-24.0"
        yloc="0.0" facing="270.0">
        <connection-list>
            <connection id="7" xloc="0.0" yloc="4.5" />
            <connection id="17" xloc="-3.0" yloc="0.0" />
            <connection id="19" xloc="3.0" yloc="0.0" />
        </connection-list>
    </building>

    <!-- The second row -->
    <building id="9" type="Hallway" length="3.0" xloc="-6.0"
        yloc="13.0" facing="270.0">
        <connection-list>
            <connection id="2" xloc="0.0" yloc="1.5" />
            <connection id="10" xloc="0.0" yloc="-1.5" />
        </connection-list>
    </building>
    <building id="10" type="Residential Quarters" xloc="-12.0"
        yloc="13.0" facing="270.0">
        <connection-list>
            <connection id="9" xloc="0.0" yloc="4.5" />
            <connection id="11" xloc="0.0" yloc="-4.5" />
        </connection-list>
    </building>

    <building id="11" type="Hallway" length="3.0" xloc="-18.0"
        yloc="13.0" facing="270.0">
        <connection-list>
            <connection id="10" xloc="0.0" yloc="1.5" />
            <connection id="12" xloc="0.0" yloc="-1.5" />
        </connection-list>
    </building>
    <building id="12" type="Inflatable Greenhouse" xloc="-24.0"
        yloc="13.0" facing="270.0">
        <connection-list>
            <connection id="11" xloc="0.0" yloc="4.5" />
            <connection id="17" xloc="3.0" yloc="0.0" />
            <connection id="18" xloc="-3.0" yloc="0.0" />
        </connection-list>
    </building>

    <!-- The third row -->
    <building id="13" type="Hallway" length="3.0" xloc="-6.0"
        yloc="26.0" facing="270.0">
        <connection-list>
            <connection id="4" xloc="0.0" yloc="1.5" />
            <connection id="14" xloc="0.0" yloc="-1.5" />
        </connection-list>
    </building>
    <building id="14" type="Lounge" xloc="-12.0" yloc="26.0"
        facing="270.0">
        <connection-list>
            <connection id="13" xloc="0.0" yloc="4.5" />
            <connection id="15" xloc="0.0" yloc="-4.5" />
        </connection-list>
    </building>

    <building id="15" type="Hallway" length="3.0" xloc="-18.0"
        yloc="26.0" facing="270.0">
        <connection-list>
            <connection id="14" xloc="0.0" yloc="1.5" />
            <connection id="16" xloc="0.0" yloc="-1.5" />
        </connection-list>
    </building>
    <building id="16" type="Inflatable Greenhouse" xloc="-24.0"
        yloc="26.0" facing="270.0">
        <connection-list>
            <connection id="15" xloc="0.0" yloc="4.5" />
            <connection id="18" xloc="3.0" yloc="0.0" />
        </connection-list>
    </building>

    <!-- This hallway connects the inflatable greenhouse on the first row
        to that of second row -->
    <building id="17" type="Hallway" length="7.0" xloc="-24.0"
        yloc="6.5" facing="0.0">
        <connection-list>
            <connection id="8" xloc="0.0" yloc="-3.5" />
            <connection id="12" xloc="0.0" yloc="3.5" />
        </connection-list>
    </building>

    <!-- This hallway connects the inflatable greenhouse on the second row
        to that of the third row -->
    <building id="18" type="Hallway" length="7.0" xloc="-24.0"
        yloc="19.5" facing="0.0">
        <connection-list>
            <connection id="12" xloc="0.0" yloc="-3.5" />
            <connection id="16" xloc="0.0" yloc="3.5" />
        </connection-list>
    </building>

    <!-- This hallway connects the inflatable greenhouse in the first row
        to the garage -->
    <building id="19" type="Hallway" length="4.0" xloc="-24.0"
        yloc="-5.0" facing="0.0">
        <connection-list>
            <connection id="8" xloc="0.0" yloc="2.0" />
            <connection id="20" xloc="0.0" yloc="-2.0" />
        </connection-list>
    </building>

    <building id="20" type="Garage" xloc="-24.0" yloc="-15"
        facing="180.0">
        <connection-list>
            <connection id="19" xloc="0.0" yloc="-8.0" />
        </connection-list>
    </building>

    <!-- EVA Airlock is attached to the lander hab -->
    <building id="21" type="EVA Airlock" xloc="7.5" yloc="0.0"
        facing="0.0">
        <connection-list>
            <connection id="0" xloc="-3.0" yloc="0.0" />
        </connection-list>
    </building>

    <building type="MD1 Nuclear Reactor" xloc="40.0"
        yloc="-60.0" facing="0.0" />
    <building type="MD1 Nuclear Reactor" xloc="40.0"
        yloc="-80.0" facing="0.0" />

    <building type="Solar Thermal Array" xloc="60.0"
        yloc="-60.0" facing="0.0" />
    <building type="Solar Thermal Array" xloc="60.0"
        yloc="-80.0" facing="0.0" />

    <building type="Large Areothermal Well" xloc="100.0"
        yloc="-100" facing="0.0" />

    <building type="ERV-A" xloc="80.0" yloc="45.0"
        facing="0.0" />
    <building type="ERV-A" xloc="120.0" yloc="45.0"
        facing="0.0" />
    <building type="ERV-A" xloc="160.0" yloc="45.0"
        facing="0.0" />
                        
    <building type="ERV-B" xloc="80.0" yloc="-15.0"
        facing="0.0" />
    <building type="ERV-B" xloc="120.0" yloc="-15.0"
        facing="0.0" />
    <building type="ERV-B" xloc="160.0" yloc="-15.0"
        facing="0.0" />

    <building type="Atmospheric Processor" xloc="20"
        yloc="-50.0" facing="90.0" />
        
    <building type="Large Sabatier Processor" xloc="0.0"
        yloc="-70.0" facing="90.0" />
    <building type="Large Sabatier Processor" xloc="0.0"
        yloc="-80.0" facing="90.0" />
    <building type="Large Sabatier Processor" xloc="0.0"
        yloc="-90.0" facing="90.0" />

    <building type="Regolith Storage Bin" xloc="35.0" yloc="0.0"
        facing="90.0" />
    <building type="Sand Storage Bin" xloc="35.0" yloc="5.0"
        facing="90.0" />
    <building type="Concrete Storage Bin" xloc="35.0"
        yloc="10.0" facing="90.0" />
    <building type="Cement Storage Bin" xloc="35.0" yloc="15.0"
        facing="90.0" />
    <building type="Mortar Storage Bin" xloc="35.0" yloc="20.0"
        facing="90.0" />
    <building type="Lime Storage Bin" xloc="35.0" yloc="25.0"
        facing="90.0" />
    <building type="Ice Storage Bin" xloc="35.0" yloc="-5.0"
        facing="90.0" />
    <building type="Carbon Storage Bin" xloc="35.0" yloc="-10.0"
        facing="90.0" />

    <vehicle type="Explorer Rover" number="2" />
    <vehicle type="Transport Rover" number="1" />
    <vehicle type="Cargo Rover" number="1" />
    <vehicle type="Light Utility Vehicle" number="2" />
    <vehicle type="Delivery Drone" number="2" />

    <equipment type="EVA Suit" number="24" />
    <equipment type="Gas Canister" number="120" />
    <equipment type="Barrel" number="120" />
    <equipment type="Bag" number="120" />
    <equipment type="Large Bag" number="70" />
    <equipment type="Specimen Box" number="70" />

	<!-- Life Support Resources -->
	<resource type="food" amount="6000.0" />
	<resource type="water" amount="12000.0" />
	<resource type="oxygen" amount="6000.0" />
	
    <part-package name="package 3" number="1" />
    
    <resupply>
       	<resupply-mission name="Standard Resupply 1"
            arrival-time="0.1" />   
        <resupply-mission name="Resupply for Phase 3"
            arrival-time="670.0" />
    </resupply>
</template>